{
  "schemaVersion": 1,
  "policyId": "conservative-root-cause-v1",
  "confidenceLevel": 0.95,
  "bootstrapIterations": 10000,
  "bootstrapSeed": "reviewops-v1",
  "minimumPairedCases": 20,
  "minimumPairedCasesPerSlice": 20,
  "decisionSliceIds": ["auth", "cross-service"],
  "sliceMultiplicityMethod": "HOLM_BONFERRONI",
  "minimumMetricCoverage": 1,
  "minimumRootCauseCoverage": 1,
  "maxPricingAgeDays": 30,
  "requiredCostBasis": "FULLY_LOADED",
  "highCriticalRootCauseNonInferiorityMargin": 0,
  "criticalMissNonInferiorityMargin": 0,
  "hallucinationNonInferiorityMargin": 0,
  "actionablePrecisionNonInferiorityMargin": 0,
  "rootCauseQualityNonInferiorityMargin": 0,
  "minimumCostPerConfirmedHighCriticalRootCauseImprovementFraction": 0.3,
  "maximumHumanReviewRegressionFraction": 0,
  "maximumP95CostRegressionFraction": 0,
  "maximumP99CostRegressionFraction": 0,
  "maximumP95LatencyRegressionFraction": 0,
  "maximumP99LatencyRegressionFraction": 0,
  "minimumFindingStability": 0.8,
  "blockingStaticRuleIds": [],
  "allowedExceptionTypes": ["P95_LATENCY", "P99_COST", "HUMAN_REVIEW"],
  "tiePolicy": "NO_AUTOMATIC_WINNER",
  "shadowObservationDays": 14,
  "rollbackCriticalMisses": 0,
  "exceptions": []
}
